神器名,アイテム説明,使用方法,使用回数,MP消費量,MP必要量,消費アイテム,CT,グローバルCT,対応信仰神
窒素固定器,水入り瓶を消費し窒素を固定する。信仰神によって効果が変わる。その神器は平時には空気からパンを生み出し、戦時には空気から火薬を生み出した。,右クリック,,50,,item.minecraft.potion  x1,,,フローラ アーバン ニャプトフ ウィ=キ ルーモア
出撃命令,全 軍 突 撃,右クリック,1,0,None,None,None,None,フローラ アーバン ニャプトフ ウィ=キ ルーモア
fruit 叡智の果実 tiurf,大空の楽園に実る禁断の果実口にすれば膨大な魔力を得られるが、代償として生命力を失ってしまう。,アイテムを使用,10,0,None,None,None,None,フローラ アーバン ニャプトフ ウィ=キ ルーモア
祭祀の杖,天候を変化させる杖雨乞いの儀式にも使われる。,右クリック,None,20,None,None,None,None,フローラ ウィ=キ ルーモア
Xx_エレメンタルソード_xX,攻撃の度に属性の変わる剣,装備しEntityを近接攻撃,250,15,None,None,None,None,アーバン ニャプトフ ルーモア
拳法の巻物,敵に軽減貫通28ダメージを与える,装備しEntityを近接攻撃,None,0,None,None,None,None,フローラ アーバン ニャプトフ
自爆命令,全 機 爆 散,右クリック,None,80,None,None,None,60,フローラ アーバン ウィ=キ
flying- 飛竜落としの術 -dragon,嘗て天を翔け世界を波乱に貶めた龍を討ち落としたとされる神器,右クリック,50,35,None,None,60,None,フローラ ニャプトフ ウィ=キ ルーモア
ディスペンサー・キャノン,TNTをぶっ飛ばすキャノンそのキレイな顔をフッ飛ばしてやる！！,右クリック,None,50,None,None,10,None,アーバン ニャプトフ ルーモア
ルナティック・レイ,敵1体に魔法攻撃,右クリック,30,20,None,None,50,None,フローラ ニャプトフ ウィ=キ ルーモア
コール:イエネコ,「可愛い猫ちゃんに癒されたい？」,右クリック,100,40,None,None,600,None,フローラ ニャプトフ ウィ=キ ルーモア
MP抽出機,MPを瓶に詰めて抽出できる1部は天使の取り分として蒸発することがある,右クリック,None,30,None,item.minecraft.glass_bottle  x1,None,None,アーバン フローラ ニャプトフ ルーモア ウィ=キ
クリスタルロッド,透明度の高いクリスタルが使用された杖。周囲のプレイヤーのバフ・デバフをかき消す。,右クリック,None,40,None,None,None,None,フローラ ニャプトフ ウィ=キ ルーモア
アモールの杖,周囲のプレイヤーの体力を少しだけ回復する,右クリック,None,20,None,None,8,None,フローラ アーバン ニャプトフ ウィ=キ ルーモア
臆病者の魂,臆病な者の怯えた思いが込められた魂ダメージを受けると恐ろしくなり家へと逃げ帰る,装備し被ダメージ,5,0,None,None,None,None,フローラ ニャプトフ ウィ=キ ルーモア
ウェブ・シューター,周囲7mのMobに蜘蛛の巣を発射し、身動きを封じる,右クリック,30,15,None,None,None,None,フローラ アーバン ウィ=キ ルーモア
おさかな,にゃー,アイテムを使用,1,10000,100,None,None,None,フローラ アーバン ニャプトフ ウィ=キ ルーモア
お願いマッスル [I類],ザッツアグレート大胸筋！腕力が10秒間上昇する体を限界まで追い込むので注意！,右クリック,None,25,None,None,None,None,アーバン ルーモア
お願いマッスル [II類],肩にちっちゃい重機のせてんのかい！肩力が10秒間上昇する体を限界まで追い込むので注意！,右クリック,None,25,None,None,None,None,フローラ アーバン
お願いマッスル [III類],レッグカール！ハックリフト！ ...にゃーん脚力が10秒間上昇する体を限界まで追い込むので注意！,右クリック,None,25,None,None,None,None,アーバン ニャプトフ ルーモア
お願いマッスル [IV類],頑張る貴方は美しい！耐力が30秒間上昇する体を限界まで追い込むので注意！,右クリック,None,25,None,None,None,None,アーバン ルーモア
雷翔-Wakinyan-,Wakinyan -ワキンヤン-インディアンの間に古来より伝わる神鳥である雷の精霊の力で自在に雷を放つと云われる,,30,50,None,None,None,None,フローラ アーバン ウィ=キ ルーモア
舞焔-Phoenix-,Phoenix -フェニックス-不死鳥と呼ばれ、火から自ら蘇る輪廻の外にある神鳥とされる,,30,50,None,None,None,None,フローラ アーバン ルーモア
ちぇん氏の夢枕,「あぁ～ためになる～」,右クリック,1,0,None,None,None,None,ニャプトフ
ヒール レベル1,治癒の祈りを通じて発動者および味方を回復する。[詳細]体力を5.7回復する。,右クリック,None,15,None,None,20,None,フローラ アーバン ニャプトフ ウィ=キ ルーモア
ホーリーシンボル レベル1,聖なる魔法陣を生成し発動者および味方の精神を浄化する。[詳細]1秒ごとにMPを1回復する。10秒間、物理/魔法ダメージ、攻撃速度が1%増加する。,右クリック,None,0,None,None,None,3600,フローラ アーバン ニャプトフ ウィ=キ ルーモア
エンジェルレイ レベル1,聖霊のオーラに満ちた強烈な光芒を前方に放ち、対象にダメージを与え、味方は回復させる。[詳細]対象:攻撃が命中すると146.4の魔法ダメージを与える。味方:体力を15.0回復する。,右クリック,None,30,None,None,600,None,フローラ アーバン ニャプトフ ウィ=キ ルーモア
起床ラッパ,朝を知らせるラッパ。この音色を聞いたら活動を始めなければならない。,右クリック,None,5,None,None,None,200,アーバン ウィ=キ ルーモア
烈火の剣,炎を纏った剣。 敵にやや強力な物理火属性ダメージを与える,装備しEntityを近接攻撃,None,7,None,None,8,None,アーバン ニャプトフ ルーモア
激流の剣,水流を纏った剣。 敵にやや強力な物理水属性ダメージを与える,装備しEntityを近接攻撃,None,7,None,None,8,None,フローラ アーバン ニャプトフ ルーモア
迅雷の剣,電気を纏った剣。 敵にやや強力な物理雷属性ダメージを与える,装備しEntityを近接攻撃,None,10,None,None,7,None,フローラ アーバン ニャプトフ ルーモア
引き寄せフックショット,ヒットした敵を使用者の手前までテレポートさせる。,,None,20,None,None,None,None,アーバン ニャプトフ ルーモア
近接フックショット,ヒットした敵の元へテレポートする,,None,40,None,None,None,None,アーバン ニャプトフ ルーモア
スーパードラゴンの呼び鈴,どっかで見た白いドラゴンを呼び出す呼び鈴。「着地時に乗り捨ては申し訳ないがNG」,右クリック,100,30,None,None,60,None,アーバン ニャプトフ ウィ=キ ルーモア
我が下に集え,周囲のモブ及びプレイヤーを自分の下に召集する。,右クリック,5,50,None,None,None,None,アーバン ウィ=キ ルーモア
たる,周囲の敵にたるを落下させるた〜る！,右クリック,100,20,None,None,10,None,フローラ アーバン ニャプトフ ウィ=キ ルーモア
サイフォジオ,斬りつけた生物のHPを回復する。,装備しEntityを近接攻撃,None,20,None,None,None,None,フローラ ニャプトフ ウィ=キ ルーモア
ファイアマジック,炎の術式を宿した杖。敵にやや強力な魔法火属性ダメージを与える,右クリック,None,13,None,None,20,None,フローラ アーバン ニャプトフ ルーモア
ウォーターマジック,波の術式を宿した杖。敵にやや強力な魔法水属性ダメージを与える,右クリック,None,50,None,None,25,None,フローラ ニャプトフ ウィ=キ ルーモア
サンダーマジック,電気の術式を宿した杖。敵にやや強力魔法雷属性ダメージを与える,右クリック,None,11,None,None,15,None,フローラ ニャプトフ ウィ=キ ルーモア
階層昇華の羽,自分の真上のブロック上にテレポートする事ができる羽,右クリック,25,20,None,None,200,None,フローラ ニャプトフ ウィ=キ ルーモア
瞬獄殺,周囲10M以内の体力が30以下の敵にダメージを与える「我こそ、拳を極めし者」軽減貫通 20ダメージ,装備している限り,None,"10",None,None,100,None,アーバン ニャプトフ ウィ=キ
イシキリチェンソー,前方の敵全体を切り刻む石切台チェンソー魔力を注ぎ込みエンジンをふかせ,右クリック,1800,1,None,None,None,None,フローラ アーバン ルーモア
ハートランド,大地の加護を得た衣喜ばしき芽生え。,装備,None,20,None,None,100,None,フローラ ニャプトフ ルーモア
ハートランド,大地の加護を得た衣我らみな大地に生きるもの。,装備している限り,None,0,None,None,None,None,フローラ ニャプトフ ルーモア
ハートランド,大地の加護を得た衣豊穣はここに。,装備している限り,None,0,None,None,None,None,フローラ ニャプトフ ルーモア
ハートランド,大地の加護を得た衣駆け出すものに祝福を。,装備している限り,None,0,None,None,None,None,フローラ ニャプトフ ルーモア
U&W-06,とある神が協力をして作り上げた神器 しかし、お互い馬が合わなかったのか 少し歪な性能をしている 再利用可能な工夫がされている,右クリック,6,0,None,None,None,None,アーバン ウィ=キ
フレイムヘルム,火耐性+3%,装備,None,0,None,None,None,None,アーバン ニャプトフ ルーモア
フレイムアーマー,火耐性+3%一式全て揃えた場合、追加で火耐性+3%,装備,None,0,None,None,None,None,アーバン ニャプトフ ルーモア
フレイムレギンス,火耐性+3%,装備,None,0,None,None,None,None,アーバン ニャプトフ ルーモア
フレイムブーツ,火耐性+3%,装備,None,0,None,None,None,None,アーバン ニャプトフ ルーモア
アイスヘルム,水耐性+3%,装備,None,0,None,None,None,None,フローラ アーバン ウィ=キ ルーモア
アイスアーマー,水耐性+3%一式全て揃えた場合、追加で水耐性+3%,装備,None,0,None,None,None,None,フローラ アーバン ウィ=キ ルーモア
アイスレギンス,水耐性+3%,装備,None,0,None,None,None,None,フローラ アーバン ウィ=キ ルーモア
アイスブーツ,水耐性+3%,装備,None,0,None,None,None,None,フローラ アーバン ウィ=キ ルーモア
エレキヘルム,雷耐性+3%,装備,None,0,None,None,None,None,フローラ アーバン ニャプトフ ウィ=キ
エレキアーマー,雷耐性+3%一式全て揃えた場合、追加で雷耐性+3%,装備,None,0,None,None,None,None,フローラ アーバン ニャプトフ ウィ=キ
エレキレギンス,雷耐性+3%,装備,None,0,None,None,None,None,フローラ アーバン ニャプトフ ウィ=キ
エレキブーツ,雷耐性+3%,装備,None,0,None,None,None,None,フローラ アーバン ニャプトフ ウィ=キ
魔法使いの帽子,魔法使いが普段身に着けている帽子魔法耐性+2.5% 魔法攻撃+2.5%MP回復量+2.5%物理耐性-2.5% 物理攻撃-2.5%,装備,None,0,None,None,None,None,フローラ ニャプトフ ウィ=キ ルーモア
魔法使いのローブ(上),魔法使いが普段身に着けているローブ魔法耐性+2.5% 魔法攻撃+2.5%MP回復量+2.5%物理耐性-2.5% 物理攻撃-2.5%,装備,None,0,None,None,None,None,フローラ ニャプトフ ウィ=キ ルーモア
魔法使いのローブ(下),魔法使いが普段身に着けているローブ魔法耐性+2.5% 魔法攻撃+2.5%MP回復量+2.5%物理耐性-2.5% 物理攻撃-2.5%,装備,None,0,None,None,None,None,フローラ ニャプトフ ウィ=キ ルーモア
魔法使いの靴,魔法使いが普段身に着けている靴魔法耐性+2.5% 魔法攻撃+2.5%MP回復量+2.5%物理耐性-2.5% 物理攻撃-2.5%,装備,None,0,None,None,None,None,フローラ ニャプトフ ウィ=キ ルーモア
重鋼の鎧,とても硬くて重い鎧,装備,None,0,None,None,None,None,アーバン フローラ ニャプトフ ルーモア ウィ=キ
重鋼の鎧,とても硬くて重い鎧,装備,None,0,None,None,None,None,アーバン フローラ ニャプトフ ルーモア ウィ=キ
重鋼の鎧,とても硬くて重い鎧,装備,None,0,None,None,None,None,アーバン フローラ ニャプトフ ルーモア ウィ=キ
重鋼の鎧,とても硬くて重い鎧,装備,None,0,None,None,None,None,アーバン フローラ ニャプトフ ルーモア ウィ=キ
ネズミの足,被ダメージ時に3秒間移動速度上昇を得る臆病なネズミの足 叩かないで！,装備し被攻撃ダメージ,None,2,None,None,None,None,ニャプトフ ウィ=キ ルーモア
謎の赤い秘石,赤い卵型の宝石だ。中に人型の何かが入っているようだダメージを受けた時、回復する,装備し被ダメージ,100,20,None,None,60,None,アーバン ウィ=キ ルーモア
火炎のリング,火炎の力を蓄えた指輪付けると力が湧いてくる,装備,None,0,None,None,None,None,アーバン ルーモア
オートトーチ,暗い場所で自動で松明を置くぞ！めんどくさい作業からはおさらば！A型の人使用禁止,装備している限り,None,0,None,block.minecraft.torch  x1,20,None,アーバン フローラ ニャプトフ ルーモア ウィ=キ
旋風の鞘,刀ではなく旋風を収めている鞘その旋風を抜いた時、前を塞ぐ者を吹き飛ばす。多く携えるほど旋風は勢いを増す。,装備しEntityを近接攻撃,None,5,None,None,5,None,フローラ アーバン ニャプトフ ルーモア
レーザーアイヘルメット,レーザーアイ形をしたヘルメットビームを放出することができる,,None,15,None,None,5,None,フローラ アーバン ニャプトフ ウィ=キ ルーモア
火のチャーム,火属性の攻撃力が5%上昇する。,装備,None,0,None,None,None,None,アーバン フローラ ニャプトフ ルーモア ウィ=キ
水のチャーム,水属性の攻撃力が5%上昇する。,装備,None,0,None,None,None,None,アーバン フローラ ニャプトフ ルーモア ウィ=キ
雷のチャーム,雷属性の攻撃力が5%上昇する。,装備,None,0,None,None,None,None,アーバン フローラ ニャプトフ ルーモア ウィ=キ
